<?xml version="1.0" encoding="UTF-8"?>
<school xmlns:xsi="http://www.w3.org/2001/XMLSchema-instance"
        xsi:noNamespaceSchemaLocation="student_ID.xsd">

  <students>
    <student id="SV101">
      <name>Trần Văn Minh</name>
      <date>2000-05-15</date>
    </student>

    <student id="SV102">
      <name>Phạm Thị Lan</name>
      <date>1999-11-02</date>
    </student>

    <student id="SV103">
      <name>Ngô Hoàng Nam</name>
      <date>2001-03-28</date>
    </student>
  </students>

  <enrollments>
    <enrollment studentRef="SV101" course="CSDL"/>
    <enrollment studentRef="SV102" course="LapTrinhJava"/>
    <enrollment studentRef="SV103" course="PhanTichThietKe"/>
    <enrollment studentRef="SV101" course="TriTueNhanTao"/>
  </enrollments>

</school>
